{
  "$schema": "vocalia-catalog-menu-v1",
  "tenant_id": "restaurant_chez_omar",
  "last_sync": "2026-02-03T10:00:00Z",
  "source": "custom",
  "menu": {
    "categories": [
      {
        "name": "Entrées",
        "items": [
          {
            "id": "E01",
            "name": "Salade marocaine",
            "price": 35,
            "currency": "MAD",
            "available": true,
            "description": "Tomates, concombres, oignons, huile d'olive",
            "allergens": [],
            "dietary": ["vegan", "gluten-free"],
            "voice_description": "Salade marocaine fraîche à 35 dirhams, végane et sans gluten"
          },
          {
            "id": "E02",
            "name": "Briouates au fromage",
            "price": 45,
            "currency": "MAD",
            "available": true,
            "description": "Feuilles de brick farcies au fromage et herbes",
            "allergens": ["dairy", "gluten"],
            "dietary": ["vegetarian"],
            "voice_description": "Briouates au fromage à 45 dirhams, végétarien"
          },
          {
            "id": "E03",
            "name": "Harira",
            "price": 30,
            "currency": "MAD",
            "available": true,
            "description": "Soupe traditionnelle aux lentilles et pois chiches",
            "allergens": ["gluten"],
            "dietary": [],
            "voice_description": "Harira traditionnelle à 30 dirhams"
          }
        ]
      },
      {
        "name": "Plats",
        "items": [
          {
            "id": "P01",
            "name": "Couscous Royal",
            "price": 120,
            "currency": "MAD",
            "available": true,
            "description": "Semoule, légumes, agneau, poulet, merguez",
            "allergens": ["gluten"],
            "dietary": [],
            "preparation_time": "25min",
            "voice_description": "Couscous royal avec agneau, poulet et merguez à 120 dirhams, préparation 25 minutes"
          },
          {
            "id": "P02",
            "name": "Tajine Agneau aux Pruneaux",
            "price": 95,
            "currency": "MAD",
            "available": true,
            "description": "Agneau mijoté aux pruneaux, amandes et miel",
            "allergens": ["nuts"],
            "dietary": ["gluten-free"],
            "preparation_time": "30min",
            "voice_description": "Tajine d'agneau aux pruneaux à 95 dirhams, sans gluten, préparation 30 minutes"
          },
          {
            "id": "P03",
            "name": "Pastilla au Poulet",
            "price": 85,
            "currency": "MAD",
            "available": true,
            "description": "Feuilleté au poulet, amandes, cannelle et sucre glace",
            "allergens": ["gluten", "nuts", "eggs"],
            "dietary": [],
            "preparation_time": "20min",
            "voice_description": "Pastilla au poulet à 85 dirhams, préparation 20 minutes"
          },
          {
            "id": "P04",
            "name": "Tajine Poulet Citron Olives",
            "price": 80,
            "currency": "MAD",
            "available": false,
            "description": "Poulet mijoté au citron confit et olives",
            "allergens": [],
            "dietary": ["gluten-free"],
            "preparation_time": "25min",
            "voice_description": "Tajine poulet citron olives à 80 dirhams, actuellement indisponible"
          }
        ]
      },
      {
        "name": "Desserts",
        "items": [
          {
            "id": "D01",
            "name": "Cornes de Gazelle",
            "price": 40,
            "currency": "MAD",
            "available": true,
            "description": "Pâtisseries aux amandes parfumées à la fleur d'oranger",
            "allergens": ["gluten", "nuts"],
            "dietary": [],
            "voice_description": "Cornes de gazelle à 40 dirhams"
          },
          {
            "id": "D02",
            "name": "Thé à la menthe",
            "price": 20,
            "currency": "MAD",
            "available": true,
            "description": "Thé vert à la menthe fraîche",
            "allergens": [],
            "dietary": ["vegan"],
            "voice_description": "Thé à la menthe à 20 dirhams"
          }
        ]
      }
    ],
    "specials": {
      "menu_du_jour": {
        "price": 85,
        "currency": "MAD",
        "includes": ["entrée", "plat", "dessert"],
        "available_days": ["monday", "tuesday", "wednesday", "thursday", "friday"],
        "voice_description": "Menu du jour à 85 dirhams avec entrée, plat et dessert au choix, du lundi au vendredi"
      },
      "formule_midi": {
        "price": 65,
        "currency": "MAD",
        "includes": ["plat", "boisson"],
        "available_days": ["monday", "tuesday", "wednesday", "thursday", "friday"],
        "voice_description": "Formule midi à 65 dirhams avec plat et boisson, du lundi au vendredi"
      }
    },
    "opening_hours": {
      "monday": "12:00-15:00, 19:00-23:00",
      "tuesday": "12:00-15:00, 19:00-23:00",
      "wednesday": "12:00-15:00, 19:00-23:00",
      "thursday": "12:00-15:00, 19:00-23:00",
      "friday": "12:00-15:00, 19:00-23:30",
      "saturday": "12:00-23:30",
      "sunday": "12:00-22:00"
    }
  }
}
